{
  "schema_version": 1,
  "benchmark_version": "1.0-rc1",
  "collected_at": "2026-08-08T20:28:56+08:00",
  "ollama_version": "0.32.6",
  "source": "ollama show --modelfile",
  "models": [
    {
      "exact_name": "deepscaler:1.5b",
      "digest": "0031bcf7459f9405e9ae68b522c3fb791ad64814eff25dbec007435d837977e6",
      "modelfile_sha256": "bc78f7ebd6b6944ad4b6ddf39ae932ec69d2613d6d061843490c48a9aef0b78d",
      "visible_declared_defaults": {
        "temperature": 0.6,
        "top_k": null,
        "top_p": 0.95,
        "min_p": null,
        "repeat_penalty": null
      },
      "stop_count": 4,
      "template_present": true,
      "system_present": false
    },
    {
      "exact_name": "deepseek-ocr:latest",
      "digest": "0e7b018b8a22373167ee79c9a852821235488cbd2a2a5a93495558627423278c",
      "modelfile_sha256": "27ec6ba2a9cca1dbbb55efe6a2309a042295b29a3c75b49903175b9c9bc56e46",
      "visible_declared_defaults": {
        "temperature": 0,
        "top_k": null,
        "top_p": null,
        "min_p": null,
        "repeat_penalty": null
      },
      "stop_count": 0,
      "template_present": true,
      "system_present": false
    },
    {
      "exact_name": "deepseek-r1:8b",
      "digest": "6995872bfe4c521a67b32da386cd21d5c6e819b6e0d62f79f64ec83be99f5763",
      "modelfile_sha256": "1147ce5608ef58cb0501aac9a17545bc611e613a58f5f16dd6b40294dcd04d84",
      "visible_declared_defaults": {
        "temperature": 0.6,
        "top_k": null,
        "top_p": 0.95,
        "min_p": null,
        "repeat_penalty": null
      },
      "stop_count": 4,
      "template_present": true,
      "system_present": false
    },
    {
      "exact_name": "functiongemma:270m",
      "digest": "7c19b650567acfb1bee50d12bb286370e8a54d8877f6a0ecfd01f8c8fdc223bb",
      "modelfile_sha256": "6fec94223e49ea7f5b699a816441a2b5050368515bfc7a61f82abb264e577122",
      "visible_declared_defaults": {
        "temperature": null,
        "top_k": 64,
        "top_p": 0.95,
        "min_p": null,
        "repeat_penalty": null
      },
      "stop_count": 0,
      "template_present": true,
      "system_present": false
    },
    {
      "exact_name": "gemma3n:e4b",
      "digest": "15cb39fd9394fd2549f6df9081cfc84dd134ecf2c9c5be911e5629920489ac32",
      "modelfile_sha256": "f53848704ad8f8c6206ce3eb72fb7dbe3d12a9ddd6253964bf1bf31adc87b1b0",
      "visible_declared_defaults": {
        "temperature": null,
        "top_k": null,
        "top_p": null,
        "min_p": null,
        "repeat_penalty": null
      },
      "stop_count": 0,
      "template_present": true,
      "system_present": false
    },
    {
      "exact_name": "gemma4:e4b",
      "digest": "c6eb396dbd5992bbe3f5cdb947e8bbc0ee413d7c17e2beaae69f5d569cf982eb",
      "modelfile_sha256": "e0954bbcd525b82f5a8666fdc3d22466ce33ee1c60066c390017bd32717d83c1",
      "visible_declared_defaults": {
        "temperature": 1,
        "top_k": 64,
        "top_p": 0.95,
        "min_p": null,
        "repeat_penalty": null
      },
      "stop_count": 0,
      "template_present": true,
      "system_present": false
    },
    {
      "exact_name": "glm-ocr:latest",
      "digest": "6effedd0dc8aec66ad86c94b8099395376e212f22c87a9d7147c422f7e447be4",
      "modelfile_sha256": "cb980c9f36f03c882ef8c81f8aadfe1fe8b201a2a02d464a2d1c2c32d796cc58",
      "visible_declared_defaults": {
        "temperature": 0,
        "top_k": null,
        "top_p": null,
        "min_p": null,
        "repeat_penalty": null
      },
      "stop_count": 0,
      "template_present": true,
      "system_present": false
    },
    {
      "exact_name": "granite4.1-guardian:8b",
      "digest": "f82c0882cec110279601307cdd632d868e29f16eaa59947bef51096e5f740492",
      "modelfile_sha256": "793cb3b95caac4dd6aad584e6c0fa8659ea5af7b42d642773e69517563c54ccc",
      "visible_declared_defaults": {
        "temperature": null,
        "top_k": null,
        "top_p": null,
        "min_p": null,
        "repeat_penalty": null
      },
      "stop_count": 0,
      "template_present": true,
      "system_present": false
    },
    {
      "exact_name": "granite4.1:8b",
      "digest": "444af1c4b2fedd6b54041aca558e7300b0b3d5c0468c44619126240323ba2852",
      "modelfile_sha256": "5432f27d9ebd508c64b8d38818901a51ea8ffc08255e70ce3431de1a336c0be4",
      "visible_declared_defaults": {
        "temperature": null,
        "top_k": null,
        "top_p": null,
        "min_p": null,
        "repeat_penalty": null
      },
      "stop_count": 0,
      "template_present": true,
      "system_present": false
    },
    {
      "exact_name": "granite4:7b-a1b-h",
      "digest": "566b725534ea0e9824f844abe6a78e1ab6f7357f1efb549be94908cb681513bb",
      "modelfile_sha256": "e776ffd81ad9fae19222e997ea49d8a0a37af8135c9f424948ea24a4c05cf991",
      "visible_declared_defaults": {
        "temperature": null,
        "top_k": null,
        "top_p": null,
        "min_p": null,
        "repeat_penalty": null
      },
      "stop_count": 0,
      "template_present": true,
      "system_present": false
    },
    {
      "exact_name": "hf.co/ibm-granite/granite-vision-4.1-4b-GGUF:Q4_K_M",
      "digest": "b4e09c173a61e28b963fc043aa86715045a50587a17a735529132fde8f979aa1",
      "modelfile_sha256": "2b663285d7d7b2a156f16c437e35b0b5928d924e489caa86a707029e9fc119ec",
      "visible_declared_defaults": {
        "temperature": null,
        "top_k": null,
        "top_p": null,
        "min_p": null,
        "repeat_penalty": null
      },
      "stop_count": 4,
      "template_present": true,
      "system_present": false
    },
    {
      "exact_name": "hf.co/lmstudio-community/Qwen3-8B-GGUF:Q4_K_M",
      "digest": "f1ab988bb6ceec875a24553886116b82b15aa804e9cb6a374a2e5e1133dd0b7d",
      "modelfile_sha256": "65778f7e9e2a7f4cdd24ea3e0ccd9cc079897b7a188fdc778e8832d29b0a45e3",
      "visible_declared_defaults": {
        "temperature": 0.6,
        "top_k": 20,
        "top_p": 0.95,
        "min_p": null,
        "repeat_penalty": 1
      },
      "stop_count": 2,
      "template_present": true,
      "system_present": false
    },
    {
      "exact_name": "hf.co/tiiuae/Falcon-H1R-7B-GGUF:Q4_K_M",
      "digest": "7a8fccc56374707c68bd2f899aeaf06b7977a71a5ea1f34b81d4c0afecd77552",
      "modelfile_sha256": "689eb8def2579e0ccc6285a71039696053d321f5593553155d0542a5b9ab6e22",
      "visible_declared_defaults": {
        "temperature": 0.6,
        "top_k": 20,
        "top_p": 0.95,
        "min_p": null,
        "repeat_penalty": 1
      },
      "stop_count": 2,
      "template_present": true,
      "system_present": false
    },
    {
      "exact_name": "hf.co/unsloth/SmolLM3-3B-GGUF:UD-Q4_K_XL",
      "digest": "49c1cb13df5f6647f0a1765a23d420f08a60bf844b1730054c59b271ea99804b",
      "modelfile_sha256": "4de365ec0f1a9f0fec4e8f1cb42a9a64f3a966ab8200d4370eed456a14e25fb4",
      "visible_declared_defaults": {
        "temperature": null,
        "top_k": null,
        "top_p": null,
        "min_p": null,
        "repeat_penalty": null
      },
      "stop_count": 3,
      "template_present": true,
      "system_present": false
    },
    {
      "exact_name": "huggingface.co/llmware/phi-4-mini-gguf:latest",
      "digest": "812893abf9e42b8b19361eff7b2f4355ccdef03bfae6283c316ca0fb286e14d0",
      "modelfile_sha256": "f74fe073b717ee215b4fb0de030e22d49c91beea5e806e2fcc8c31b933f5d521",
      "visible_declared_defaults": {
        "temperature": null,
        "top_k": null,
        "top_p": null,
        "min_p": null,
        "repeat_penalty": null
      },
      "stop_count": 0,
      "template_present": true,
      "system_present": false
    },
    {
      "exact_name": "huggingface.co/lmstudio-community/DeepSeek-R1-0528-Qwen3-8B-GGUF:latest",
      "digest": "1a41a532bd9af10aa092d04bcd0ed7a20c9f4f39bf592d9cea55f46efae6b2f9",
      "modelfile_sha256": "933f956b57d8485f64cb05e6167c244762fb4e8830875dc4d6236358daedaeb6",
      "visible_declared_defaults": {
        "temperature": 0.6,
        "top_k": null,
        "top_p": 0.95,
        "min_p": null,
        "repeat_penalty": null
      },
      "stop_count": 0,
      "template_present": true,
      "system_present": false
    },
    {
      "exact_name": "kaelri/hy-mt2:7b-q4_K_M",
      "digest": "1981e6ac165f7a519ae9fd6571b78284dae89d6d8fa7bd11ab20c1c7a7f89144",
      "modelfile_sha256": "b4e58321a26a0e2ba3e092825b9d50dd9a6590bee4b6ded43cd4cf927ac2626d",
      "visible_declared_defaults": {
        "temperature": 0.7,
        "top_k": 20,
        "top_p": 0.6,
        "min_p": null,
        "repeat_penalty": 1.05
      },
      "stop_count": 7,
      "template_present": true,
      "system_present": false
    },
    {
      "exact_name": "lfm2.5:8b",
      "digest": "9cf756159fc2f3b9128c6a3f544ec90c5e9b8afdbb4179a57b8aea9de589cfb2",
      "modelfile_sha256": "0030cd37b2170ddab67ecbfa408b9c5e74fed36768e5f4b43935f3875d2dd298",
      "visible_declared_defaults": {
        "temperature": 0.2,
        "top_k": 80,
        "top_p": null,
        "min_p": null,
        "repeat_penalty": 1.05
      },
      "stop_count": 0,
      "template_present": true,
      "system_present": false
    },
    {
      "exact_name": "llama3.2:3b",
      "digest": "a80c4f17acd55265feec403c7aef86be0c25983ab279d83f3bcd3abbcb5b8b72",
      "modelfile_sha256": "8a859ef8af7f7c8f2ca8c65afbd8c1a2f8b8abdb379cc25b49cc4ac1331e8a4c",
      "visible_declared_defaults": {
        "temperature": null,
        "top_k": null,
        "top_p": null,
        "min_p": null,
        "repeat_penalty": null
      },
      "stop_count": 3,
      "template_present": true,
      "system_present": false
    },
    {
      "exact_name": "medgemma1.5:4b",
      "digest": "433252621ab154668b5d8be6aff6c1b771bacba045e46e6193da8d6ad1630f2c",
      "modelfile_sha256": "a5277e4941fd20e2beecccc9d6775658bf2283f6ef59c4067c26d5034ab804d5",
      "visible_declared_defaults": {
        "temperature": null,
        "top_k": null,
        "top_p": null,